docid,title,abstract,url,published,authors
228,ShizishanGPT: An Agricultural Large Language Model Integrating Tools and Resources,"Recent developments in large language models (LLMs) have led to significant
improvements in intelligent dialogue systems'ability to handle complex
inquiries. However, current LLMs still exhibit limitations in specialized
domain knowledge, particularly in technical fields such as agriculture. To
address this problem, we propose ShizishanGPT, an intelligent question
answering system for agriculture based on the Retrieval Augmented Generation
(RAG) framework and agent architecture. ShizishanGPT consists of five key
modules: including a generic GPT-4 based module for answering general
questions; a search engine module that compensates for the problem that the
large language model's own knowledge cannot be updated in a timely manner; an
agricultural knowledge graph module for providing domain facts; a retrieval
module which uses RAG to supplement domain knowledge; and an agricultural agent
module, which invokes specialized models for crop phenotype prediction, gene
expression analysis, and so on. We evaluated the ShizishanGPT using a dataset
containing 100 agricultural questions specially designed for this study. The
experimental results show that the tool significantly outperforms general LLMs
as it provides more accurate and detailed answers due to its modular design and
integration of different domain knowledge sources. Our source code, dataset,
and model weights are publicly available at https://github.com/Zaiwen/CropGPT.",http://arxiv.org/abs/2409.13537v1,9/20/24,"Shuting Yang, Zehui Liu, Wolfgang Mayer"
229,Ontology-Aware RAG for Improved Question-Answering in Cybersecurity Education,"Integrating AI into education has the potential to transform the teaching of
science and technology courses, particularly in the field of cybersecurity.
AI-driven question-answering (QA) systems can actively manage uncertainty in
cybersecurity problem-solving, offering interactive, inquiry-based learning
experiences. Large language models (LLMs) have gained prominence in AI-driven
QA systems, offering advanced language understanding and user engagement.
However, they face challenges like hallucinations and limited domain-specific
knowledge, which reduce their reliability in educational settings. To address
these challenges, we propose CyberRAG, an ontology-aware retrieval-augmented
generation (RAG) approach for developing a reliable and safe QA system in
cybersecurity education. CyberRAG employs a two-step approach: first, it
augments the domain-specific knowledge by retrieving validated cybersecurity
documents from a knowledge base to enhance the relevance and accuracy of the
response. Second, it mitigates hallucinations and misuse by integrating a
knowledge graph ontology to validate the final answer. Experiments on publicly
available cybersecurity datasets show that CyberRAG delivers accurate, reliable
responses aligned with domain knowledge, demonstrating the potential of AI
tools to enhance education.",http://arxiv.org/abs/2412.14191v1,12/10/24,"Chengshuai Zhao, Garima Agrawal, Tharindu Kumarage, Zhen Tan, Yuli Deng, YingChih Chen, Huan Liu"
230,Motif Counting in Complex Networks: A Comprehensive Survey,"Motif counting plays a crucial role in understanding the structural
properties of networks. By computing motif frequencies, researchers can draw
key insights into the structural properties of the underlying network. As
networks become increasingly complex, different graph models have been
proposed, giving rise to diverse motif patterns. These variations introduce
unique computational challenges that require specialized algorithms tailored to
specific motifs within different graph structures. This survey provides a
comprehensive and structured overview of motif counting techniques across
general graphs, heterogeneous graphs, and hypergraphs. We categorize existing
algorithms according to their underlying computational strategies, emphasizing
key similarities and distinctions. In addition to reviewing current
methodologies, we examine their strengths, limitations, and computational
trade-offs. Furthermore, we explore future directions in motif counting,
including scalable implementations to improve efficiency in large-scale
networks, algorithmic adaptations for dynamic, temporal, and attributed graphs,
and deeper integration with large language models (LLMs) and graph-based
retrieval-augmented generation (GraphRAG). By offering a detailed analysis of
these approaches, this survey aims to support researchers and practitioners in
advancing motif counting for increasingly complex network data.",http://arxiv.org/abs/2503.19573v1,3/25/25,"Haozhe Yin, Kai Wang, Wenjie Zhang, Yizhang He, Ying Zhang, Xuemin Lin"
231,Parametric Retrieval Augmented Generation,"Retrieval-augmented generation (RAG) techniques have emerged as a promising
solution to enhance the reliability of large language models (LLMs) by
addressing issues like hallucinations, outdated knowledge, and domain
adaptation. In particular, existing RAG methods append relevant documents
retrieved from external corpus or databases to the input of LLMs to guide their
generation process, which we refer to as the in-context knowledge injection
method. While this approach is simple and often effective, it has inherent
limitations. Firstly, increasing the context length and number of relevant
documents can lead to higher computational overhead and degraded performance,
especially in complex reasoning tasks. More importantly, in-context knowledge
injection operates primarily at the input level, but LLMs store their internal
knowledge in their parameters. This gap fundamentally limits the capacity of
in-context methods. To this end, we introduce Parametric retrieval-augmented
generation (Parametric RAG), a new RAG paradigm that integrates external
knowledge directly into the parameters of feed-forward networks (FFN) of an LLM
through document parameterization. This approach not only saves online
computational costs by eliminating the need to inject multiple documents into
the LLMs' input context, but also deepens the integration of external knowledge
into the parametric knowledge space of the LLM. Experimental results
demonstrate that Parametric RAG substantially enhances both the effectiveness
and efficiency of knowledge augmentation in LLMs. Also, it can be combined with
in-context RAG methods to achieve even better performance.
  We have open-sourced all the code, data, and models in the following
anonymized GitHub link: https://github.com/oneal2000/PRAG",http://arxiv.org/abs/2501.15915v1,1/27/25,"Weihang Su, Yichen Tang, Qingyao Ai, Junxi Yan, Changyue Wang, Hongning Wang, Ziyi Ye, Yujia Zhou, Yiqun Liu"
232,Logic Query of Thoughts: Guiding Large Language Models to Answer Complex Logic Queries with Knowledge Graphs,"Despite the superb performance in many tasks, large language models (LLMs)
bear the risk of generating hallucination or even wrong answers when confronted
with tasks that demand the accuracy of knowledge. The issue becomes even more
noticeable when addressing logic queries that require multiple logic reasoning
steps. On the other hand, knowledge graph (KG) based question answering methods
are capable of accurately identifying the correct answers with the help of
knowledge graph, yet its accuracy could quickly deteriorate when the knowledge
graph itself is sparse and incomplete. It remains a critical challenge on how
to integrate knowledge graph reasoning with LLMs in a mutually beneficial way
so as to mitigate both the hallucination problem of LLMs as well as the
incompleteness issue of knowledge graphs. In this paper, we propose
'Logic-Query-of-Thoughts' (LGOT) which is the first of its kind to combine LLMs
with knowledge graph based logic query reasoning. LGOT seamlessly combines
knowledge graph reasoning and LLMs, effectively breaking down complex logic
queries into easy to answer subquestions. Through the utilization of both
knowledge graph reasoning and LLMs, it successfully derives answers for each
subquestion. By aggregating these results and selecting the highest quality
candidate answers for each step, LGOT achieves accurate results to complex
questions. Our experimental findings demonstrate substantial performance
enhancements, with up to 20% improvement over ChatGPT.",http://arxiv.org/abs/2404.04264v5,3/17/24,"Lihui Liu, Zihao Wang, Ruizhong Qiu, Yikun Ban, Eunice Chan, Yangqiu Song, Jingrui He, Hanghang Tong"
233,Enhancing LLM Generation with Knowledge Hypergraph for Evidence-Based Medicine,"Evidence-based medicine (EBM) plays a crucial role in the application of
large language models (LLMs) in healthcare, as it provides reliable support for
medical decision-making processes. Although it benefits from current
retrieval-augmented generation~(RAG) technologies, it still faces two
significant challenges: the collection of dispersed evidence and the efficient
organization of this evidence to support the complex queries necessary for EBM.
To tackle these issues, we propose using LLMs to gather scattered evidence from
multiple sources and present a knowledge hypergraph-based evidence management
model to integrate these evidence while capturing intricate relationships.
Furthermore, to better support complex queries, we have developed an
Importance-Driven Evidence Prioritization (IDEP) algorithm that utilizes the
LLM to generate multiple evidence features, each with an associated importance
score, which are then used to rank the evidence and produce the final retrieval
results. Experimental results from six datasets demonstrate that our approach
outperforms existing RAG techniques in application domains of interest to EBM,
such as medical quizzing, hallucination detection, and decision support.
Testsets and the constructed knowledge graph can be accessed at
\href{https://drive.google.com/file/d/1WJ9QTokK3MdkjEmwuFQxwH96j_Byawj_/view?usp=drive_link}{https://drive.google.com/rag4ebm}.",http://arxiv.org/abs/2503.16530v1,3/18/25,"Chengfeng Dou, Ying Zhang, Zhi Jin, Wenpin Jiao, Haiyan Zhao, Yongqiang Zhao, Zhengwei Tao"
234,AIPatient: Simulating Patients with EHRs and LLM Powered Agentic Workflow,"Simulated patient systems play a crucial role in modern medical education and
research, providing safe, integrative learning environments and enabling
clinical decision-making simulations. Large Language Models (LLM) could advance
simulated patient systems by replicating medical conditions and patient-doctor
interactions with high fidelity and low cost. However, ensuring the
effectiveness and trustworthiness of these systems remains a challenge, as they
require a large, diverse, and precise patient knowledgebase, along with a
robust and stable knowledge diffusion to users. Here, we developed AIPatient,
an advanced simulated patient system with AIPatient Knowledge Graph (AIPatient
KG) as the input and the Reasoning Retrieval-Augmented Generation (Reasoning
RAG) agentic workflow as the generation backbone. AIPatient KG samples data
from Electronic Health Records (EHRs) in the Medical Information Mart for
Intensive Care (MIMIC)-III database, producing a clinically diverse and
relevant cohort of 1,495 patients with high knowledgebase validity (F1 0.89).
Reasoning RAG leverages six LLM powered agents spanning tasks including
retrieval, KG query generation, abstraction, checker, rewrite, and
summarization. This agentic framework reaches an overall accuracy of 94.15% in
EHR-based medical Question Answering (QA), outperforming benchmarks that use
either no agent or only partial agent integration. Our system also presents
high readability (median Flesch Reading Ease 77.23; median Flesch Kincaid Grade
5.6), robustness (ANOVA F-value 0.6126, p>0.1), and stability (ANOVA F-value
0.782, p>0.1). The promising performance of the AIPatient system highlights its
potential to support a wide range of applications, including medical education,
model evaluation, and system integration.",http://arxiv.org/abs/2409.18924v2,9/27/24,"Huizi Yu, Jiayan Zhou, Lingyao Li, Shan Chen, Jack Gallifant, Anye Shi, Xiang Li, Wenyue Hua, Mingyu Jin, Guang Chen, Yang Zhou, Zhao Li, Trisha Gupte, MingLi Chen, Zahra Azizi, Yongfeng Zhang, Themistocles L Assimes, Xin Ma, Danielle S Bitterman, Lin Lu, Lizhou Fan"
235,PAT-Questions: A Self-Updating Benchmark for Present-Anchored Temporal Question-Answering,"Existing work on Temporal Question Answering (TQA) has predominantly focused
on questions anchored to specific timestamps or events (e.g. ""Who was the US
president in 1970?""). Little work has studied questions whose temporal context
is relative to the present time (e.g. ""Who was the previous US president?""). We
refer to this problem as Present-Anchored Temporal QA (PATQA). PATQA poses
unique challenges: (1) large language models (LLMs) may have outdated
knowledge, (2) complex temporal relationships (e.g. 'before', 'previous') are
hard to reason, (3) multi-hop reasoning may be required, and (4) the gold
answers of benchmarks must be continuously updated. To address these
challenges, we introduce the PAT-Questions benchmark, which includes single and
multi-hop temporal questions. The answers in PAT-Questions can be automatically
refreshed by re-running SPARQL queries on a knowledge graph, if available. We
evaluate several state-of-the-art LLMs and a SOTA temporal reasoning model
(TEMPREASON-T5) on PAT-Questions through direct prompting and
retrieval-augmented generation (RAG). The results highlight the limitations of
existing solutions in PATQA and motivate the need for new methods to improve
PATQA reasoning capabilities.",http://arxiv.org/abs/2402.11034v2,2/16/24,"Jannat Ara Meem, Muhammad Shihab Rashid, Yue Dong, Vagelis Hristidis"
236,GRADA: Graph-based Reranker against Adversarial Documents Attack,"Retrieval Augmented Generation (RAG) frameworks improve the accuracy of large
language models (LLMs) by integrating external knowledge from retrieved
documents, thereby overcoming the limitations of models' static intrinsic
knowledge. However, these systems are susceptible to adversarial attacks that
manipulate the retrieval process by introducing documents that are adversarial
yet semantically similar to the query. Notably, while these adversarial
documents resemble the query, they exhibit weak similarity to benign documents
in the retrieval set. Thus, we propose a simple yet effective Graph-based
Reranking against Adversarial Document Attacks (GRADA) framework aiming at
preserving retrieval quality while significantly reducing the success of
adversaries. Our study evaluates the effectiveness of our approach through
experiments conducted on five LLMs: GPT-3.5-Turbo, GPT-4o, Llama3.1-8b,
Llama3.1-70b, and Qwen2.5-7b. We use three datasets to assess performance, with
results from the Natural Questions dataset demonstrating up to an 80% reduction
in attack success rates while maintaining minimal loss in accuracy.",http://arxiv.org/abs/2505.07546v1,5/12/25,"Jingjie Zheng, Aryo Pradipta Gema, Giwon Hong, Xuanli He, Pasquale Minervini, Youcheng Sun, Qiongkai Xu"
237,Multi-Paragraph Reasoning with Knowledge-enhanced Graph Neural Network,"Multi-paragraph reasoning is indispensable for open-domain question answering
(OpenQA), which receives less attention in the current OpenQA systems. In this
work, we propose a knowledge-enhanced graph neural network (KGNN), which
performs reasoning over multiple paragraphs with entities. To explicitly
capture the entities' relatedness, KGNN utilizes relational facts in knowledge
graph to build the entity graph. The experimental results show that KGNN
outperforms in both distractor and full wiki settings than baselines methods on
HotpotQA dataset. And our further analysis illustrates KGNN is effective and
robust with more retrieved paragraphs.",http://arxiv.org/abs/1911.02170v1,11/6/19,"Deming Ye, Yankai Lin, Zhenghao Liu, Zhiyuan Liu, Maosong Sun"
238,Zero-shot Slot Filling with DPR and RAG,"The ability to automatically extract Knowledge Graphs (KG) from a given
collection of documents is a long-standing problem in Artificial Intelligence.
One way to assess this capability is through the task of slot filling. Given an
entity query in form of [Entity, Slot, ?], a system is asked to `fill' the slot
by generating or extracting the missing value from a relevant passage or
passages. This capability is crucial to create systems for automatic knowledge
base population, which is becoming in ever-increasing demand, especially in
enterprise applications. Recently, there has been a promising direction in
evaluating language models in the same way we would evaluate knowledge bases,
and the task of slot filling is the most suitable to this intent. The recent
advancements in the field try to solve this task in an end-to-end fashion using
retrieval-based language models. Models like Retrieval Augmented Generation
(RAG) show surprisingly good performance without involving complex information
extraction pipelines. However, the results achieved by these models on the two
slot filling tasks in the KILT benchmark are still not at the level required by
real-world information extraction systems. In this paper, we describe several
strategies we adopted to improve the retriever and the generator of RAG in
order to make it a better slot filler. Our KGI0 system (available at
https://github.com/IBM/retrieve-write-slot-filling) reached the top-1 position
on the KILT leaderboard on both T-REx and zsRE dataset with a large margin.",http://arxiv.org/abs/2104.08610v1,4/17/21,"Michael Glass, Gaetano Rossiello, Alfio Gliozzo"
239,WavRAG: Audio-Integrated Retrieval Augmented Generation for Spoken Dialogue Models,"Retrieval Augmented Generation (RAG) has gained widespread adoption owing to
its capacity to empower large language models (LLMs) to integrate external
knowledge. However, existing RAG frameworks are primarily designed for
text-based LLMs and rely on Automatic Speech Recognition to process speech
input, which discards crucial audio information, risks transcription errors,
and increases computational overhead. Therefore, we introduce WavRAG, the first
retrieval augmented generation framework with native, end-to-end audio support.
WavRAG offers two key features: 1) Bypassing ASR, WavRAG directly processes raw
audio for both embedding and retrieval. 2) WavRAG integrates audio and text
into a unified knowledge representation. Specifically, we propose the
WavRetriever to facilitate the retrieval from a text-audio hybrid knowledge
base, and further enhance the in-context capabilities of spoken dialogue models
through the integration of chain-of-thought reasoning. In comparison to
state-of-the-art ASR-Text RAG pipelines, WavRAG achieves comparable retrieval
performance while delivering a 10x acceleration. Furthermore, WavRAG's unique
text-audio hybrid retrieval capability extends the boundaries of RAG to the
audio modality.",http://arxiv.org/abs/2502.14727v1,2/20/25,"Yifu Chen, Shengpeng Ji, Haoxiao Wang, Ziqing Wang, Siyu Chen, Jinzheng He, Jin Xu, Zhou Zhao"
240,Accelerating Manufacturing Scale-Up from Material Discovery Using Agentic Web Navigation and Retrieval-Augmented AI for Process Engineering Schematics Design,"Process Flow Diagrams (PFDs) and Process and Instrumentation Diagrams (PIDs)
are critical tools for industrial process design, control, and safety. However,
the generation of precise and regulation-compliant diagrams remains a
significant challenge, particularly in scaling breakthroughs from material
discovery to industrial production in an era of automation and digitalization.
This paper introduces an autonomous agentic framework to address these
challenges through a twostage approach involving knowledge acquisition and
generation. The framework integrates specialized sub-agents for retrieving and
synthesizing multimodal data from publicly available online sources and
constructs ontological knowledge graphs using a Graph Retrieval-Augmented
Generation (Graph RAG) paradigm. These capabilities enable the automation of
diagram generation and open-domain question answering (ODQA) tasks with high
contextual accuracy. Extensive empirical experiments demonstrate the frameworks
ability to deliver regulation-compliant diagrams with minimal expert
intervention, highlighting its practical utility for industrial applications.",http://arxiv.org/abs/2412.05937v1,12/8/24,"Sakhinana Sagar Srinivas, Akash Das, Shivam Gupta, Venkataramana Runkana"
241,CAPRAG: A Large Language Model Solution for Customer Service and Automatic Reporting using Vector and Graph Retrieval-Augmented Generation,"The introduction of new features and services in the banking sector often
overwhelms customers, creating an opportunity for banks to enhance user
experience through financial chatbots powered by large language models (LLMs).
We initiated an AI agent designed to provide customers with relevant
information about banking services and insights from annual reports. We
proposed a hybrid Customer Analysis Pipeline Retrieval-Augmented Generation
(CAPRAG) that effectively addresses both relationship-based and contextual
queries, thereby improving customer engagement in the digital banking
landscape. To implement this, we developed a processing pipeline to refine text
data, which we utilized in two main frameworks: Vector RAG and Graph RAG. This
dual approach enables us to populate both vector and graph databases with
processed data for efficient retrieval. The Cypher query component is employed
to effectively query the graph database. When a user submits a query, it is
first expanded by a query expansion module before being routed to construct a
final query from the hybrid Knowledge Base (KB). This final query is then sent
to an open-source LLM for response generation. Overall, our innovative,
designed to international banks, serves bank's customers in an increasingly
complex digital environment, enhancing clarity and accessibility of
information.",http://arxiv.org/abs/2501.13993v1,1/23/25,"Hamza Landolsi, Kais Letaief, Nizar Taghouti, Ines AbdeljaouedTej"
242,Knowledge Pyramid Construction for Multi-Level Retrieval-Augmented Generation,"This paper addresses the need for improved precision in existing
knowledge-enhanced question-answering frameworks, specifically
Retrieval-Augmented Generation (RAG) methods that primarily focus on enhancing
recall. We propose a multi-layer knowledge pyramid approach within the RAG
framework to achieve a better balance between precision and recall. The
knowledge pyramid consists of three layers: Ontologies, Knowledge Graphs (KGs),
and chunk-based raw text. We employ cross-layer augmentation techniques for
comprehensive knowledge coverage and dynamic updates of the Ontology schema and
instances. To ensure compactness, we utilize cross-layer filtering methods for
knowledge condensation in KGs. Our approach, named PolyRAG, follows a waterfall
model for retrieval, starting from the top of the pyramid and progressing down
until a confident answer is obtained. We introduce two benchmarks for
domain-specific knowledge retrieval, one in the academic domain and the other
in the financial domain. The effectiveness of the methods has been validated
through comprehensive experiments by outperforming 19 SOTA methods. An
encouraging observation is that the proposed method has augmented the GPT-4,
providing 395% F1 gain by improving its performance from 0.1636 to 0.8109.",http://arxiv.org/abs/2407.21276v3,7/31/24,"Rubing Chen, Xulu Zhang, Jiaxin Wu, Wenqi Fan, XiaoYong Wei, Qing Li"
243,RAG-Gym: Optimizing Reasoning and Search Agents with Process Supervision,"Retrieval-augmented generation (RAG) has shown great potential for
knowledge-intensive tasks, but its traditional architectures rely on static
retrieval, limiting their effectiveness for complex questions that require
sequential information-seeking. While agentic reasoning and search offer a more
adaptive approach, most existing methods depend heavily on prompt engineering.
In this work, we introduce RAG-Gym, a unified optimization framework that
enhances information-seeking agents through fine-grained process supervision at
each search step. We also propose ReSearch, a novel agent architecture that
synergizes answer reasoning and search query generation within the RAG-Gym
framework. Experiments on four challenging datasets show that RAG-Gym improves
performance by up to 25.6\% across various agent architectures, with ReSearch
consistently outperforming existing baselines. Further analysis highlights the
effectiveness of advanced LLMs as process reward judges and the transferability
of trained reward models as verifiers for different LLMs. Additionally, we
examine the scaling properties of training and inference in agentic RAG. The
project homepage is available at https://rag-gym.github.io/.",http://arxiv.org/abs/2502.13957v1,2/19/25,"Guangzhi Xiong, Qiao Jin, Xiao Wang, Yin Fang, Haolin Liu, Yifan Yang, Fangyuan Chen, Zhixing Song, Dengyu Wang, Minjia Zhang, Zhiyong Lu, Aidong Zhang"
