docid,title,abstract,url,published,authors
146,CG-RAG: Research Question Answering by Citation Graph Retrieval-Augmented LLMs,"Research question answering requires accurate retrieval and contextual
understanding of scientific literature. However, current Retrieval-Augmented
Generation (RAG) methods often struggle to balance complex document
relationships with precise information retrieval. In this paper, we introduce
Contextualized Graph Retrieval-Augmented Generation (CG-RAG), a novel framework
that integrates sparse and dense retrieval signals within graph structures to
enhance retrieval efficiency and subsequently improve generation quality for
research question answering. First, we propose a contextual graph
representation for citation graphs, effectively capturing both explicit and
implicit connections within and across documents. Next, we introduce
Lexical-Semantic Graph Retrieval (LeSeGR), which seamlessly integrates sparse
and dense retrieval signals with graph encoding. It bridges the gap between
lexical precision and semantic understanding in citation graph retrieval,
demonstrating generalizability to existing graph retrieval and hybrid retrieval
methods. Finally, we present a context-aware generation strategy that utilizes
the retrieved graph-structured information to generate precise and contextually
enriched responses using large language models (LLMs). Extensive experiments on
research question answering benchmarks across multiple domains demonstrate that
our CG-RAG framework significantly outperforms RAG methods combined with
various state-of-the-art retrieval approaches, delivering superior retrieval
accuracy and generation quality.",http://arxiv.org/abs/2501.15067v1,1/25/25,"Yuntong Hu, Zhihan Lei, Zhongjie Dai, Allen Zhang, Abhinav Angirekula, Zheng Zhang, Liang Zhao"
147,Exploring the Role of Knowledge Graph-Based RAG in Japanese Medical Question Answering with Small-Scale LLMs,"Large language models (LLMs) perform well in medical QA, but their
effectiveness in Japanese contexts is limited due to privacy constraints that
prevent the use of commercial models like GPT-4 in clinical settings. As a
result, recent efforts focus on instruction-tuning open-source LLMs, though the
potential of combining them with retrieval-augmented generation (RAG) remains
underexplored. To bridge this gap, we are the first to explore a knowledge
graph-based (KG) RAG framework for Japanese medical QA small-scale open-source
LLMs. Experimental results show that KG-based RAG has only a limited impact on
Japanese medical QA using small-scale open-source LLMs. Further case studies
reveal that the effectiveness of the RAG is sensitive to the quality and
relevance of the external retrieved content. These findings offer valuable
insights into the challenges and potential of applying RAG in Japanese medical
QA, while also serving as a reference for other low-resource languages.",http://arxiv.org/abs/2504.10982v5,4/15/25,"Yingjian Chen, Feiyang Li, Xingyu Song, Tianxiao Li, Zixin Xu, Xiujie Chen, Issey Sukeda, Irene Li"
148,Graph-Augmented Reasoning: Evolving Step-by-Step Knowledge Graph Retrieval for LLM Reasoning,"Recent large language model (LLM) reasoning, despite its success, suffers
from limited domain knowledge, susceptibility to hallucinations, and
constrained reasoning depth, particularly in small-scale models deployed in
resource-constrained environments. This paper presents the first investigation
into integrating step-wise knowledge graph retrieval with step-wise reasoning
to address these challenges, introducing a novel paradigm termed as
graph-augmented reasoning. Our goal is to enable frozen, small-scale LLMs to
retrieve and process relevant mathematical knowledge in a step-wise manner,
enhancing their problem-solving abilities without additional training. To this
end, we propose KG-RAR, a framework centered on process-oriented knowledge
graph construction, a hierarchical retrieval strategy, and a universal
post-retrieval processing and reward model (PRP-RM) that refines retrieved
information and evaluates each reasoning step. Experiments on the Math500 and
GSM8K benchmarks across six models demonstrate that KG-RAR yields encouraging
results, achieving a 20.73\% relative improvement with Llama-3B on Math500.",http://arxiv.org/abs/2503.01642v1,3/3/25,"Wenjie Wu, Yongcheng Jing, Yingjie Wang, Wenbin Hu, Dacheng Tao"
149,VideoRAG: Retrieval-Augmented Generation with Extreme Long-Context Videos,"Retrieval-Augmented Generation (RAG) has demonstrated remarkable success in
enhancing Large Language Models (LLMs) through external knowledge integration,
yet its application has primarily focused on textual content, leaving the rich
domain of multi-modal video knowledge predominantly unexplored. This paper
introduces VideoRAG, the first retrieval-augmented generation framework
specifically designed for processing and understanding extremely long-context
videos. Our core innovation lies in its dual-channel architecture that
seamlessly integrates (i) graph-based textual knowledge grounding for capturing
cross-video semantic relationships, and (ii) multi-modal context encoding for
efficiently preserving visual features. This novel design empowers VideoRAG to
process unlimited-length videos by constructing precise knowledge graphs that
span multiple videos while maintaining semantic dependencies through
specialized multi-modal retrieval paradigms. Through comprehensive empirical
evaluation on our proposed LongerVideos benchmark-comprising over 160 videos
totaling 134+ hours across lecture, documentary, and entertainment
categories-VideoRAG demonstrates substantial performance compared to existing
RAG alternatives and long video understanding methods. The source code of
VideoRAG implementation and the benchmark dataset are openly available at:
https://github.com/HKUDS/VideoRAG.",http://arxiv.org/abs/2502.01549v1,2/3/25,"Xubin Ren, Lingrui Xu, Long Xia, Shuaiqiang Wang, Dawei Yin, Chao Huang"
150,Vendi-RAG: Adaptively Trading-Off Diversity And Quality Significantly Improves Retrieval Augmented Generation With LLMs,"Retrieval-augmented generation (RAG) enhances large language models (LLMs)
for domain-specific question-answering (QA) tasks by leveraging external
knowledge sources. However, traditional RAG systems primarily focus on
relevance-based retrieval and often struggle with redundancy, especially when
reasoning requires connecting information from multiple sources. This paper
introduces Vendi-RAG, a framework based on an iterative process that jointly
optimizes retrieval diversity and answer quality. This joint optimization leads
to significantly higher accuracy for multi-hop QA tasks. Vendi-RAG leverages
the Vendi Score (VS), a flexible similarity-based diversity metric, to promote
semantic diversity in document retrieval. It then uses an LLM judge that
evaluates candidate answers, generated after a reasoning step, and outputs a
score that the retriever uses to balance relevance and diversity among the
retrieved documents during each iteration. Experiments on three challenging
datasets -- HotpotQA, MuSiQue, and 2WikiMultiHopQA -- demonstrate Vendi-RAG's
effectiveness in multi-hop reasoning tasks. The framework achieves significant
accuracy improvements over traditional single-step and multi-step RAG
approaches, with accuracy increases reaching up to +4.2% on HotpotQA, +4.1% on
2WikiMultiHopQA, and +1.3% on MuSiQue compared to Adaptive-RAG, the current
best baseline. The benefits of Vendi-RAG are even more pronounced as the number
of retrieved documents increases. Finally, we evaluated Vendi-RAG across
different LLM backbones, including GPT-3.5, GPT-4, and GPT-4o-mini, and
observed consistent improvements, demonstrating that the framework's advantages
are model-agnostic.",http://arxiv.org/abs/2502.11228v2,2/16/25,"Mohammad Reza Rezaei, Adji Bousso Dieng"
151,Auto-RAG: Autonomous Retrieval-Augmented Generation for Large Language Models,"Iterative retrieval refers to the process in which the model continuously
queries the retriever during generation to enhance the relevance of the
retrieved knowledge, thereby improving the performance of Retrieval-Augmented
Generation (RAG). Existing work typically employs few-shot prompting or
manually constructed rules to implement iterative retrieval. This introduces
additional inference overhead and overlooks the remarkable reasoning
capabilities of Large Language Models (LLMs). In this paper, we introduce
Auto-RAG, an autonomous iterative retrieval model centered on the LLM's
powerful decision-making capabilities. Auto-RAG engages in multi-turn dialogues
with the retriever, systematically planning retrievals and refining queries to
acquire valuable knowledge. This process continues until sufficient external
information is gathered, at which point the results are presented to the user.
To this end, we develop a method for autonomously synthesizing reasoning-based
decision-making instructions in iterative retrieval and fine-tuned the latest
open-source LLMs. The experimental results indicate that Auto-RAG is capable of
autonomous iterative interaction with the retriever, effectively leveraging the
remarkable reasoning and decision-making abilities of LLMs, which lead to
outstanding performance across six benchmarks. Further analysis reveals that
Auto-RAG can autonomously adjust the number of iterations based on the
difficulty of the questions and the utility of the retrieved knowledge, without
requiring any human intervention. Moreover, Auto-RAG expresses the iterative
retrieval process in natural language, enhancing interpretability while
providing users with a more intuitive experience\footnote{Code is available at
\url{https://github.com/ictnlp/Auto-RAG}.",http://arxiv.org/abs/2411.19443v1,11/29/24,"Tian Yu, Shaolei Zhang, Yang Feng"
152,Enhancing Large Language Models (LLMs) for Telecommunications using Knowledge Graphs and Retrieval-Augmented Generation,"Large language models (LLMs) have made significant progress in
general-purpose natural language processing tasks. However, LLMs are still
facing challenges when applied to domain-specific areas like
telecommunications, which demands specialized expertise and adaptability to
evolving standards. This paper presents a novel framework that combines
knowledge graph (KG) and retrieval-augmented generation (RAG) techniques to
enhance LLM performance in the telecom domain. The framework leverages a KG to
capture structured, domain-specific information about network protocols,
standards, and other telecom-related entities, comprehensively representing
their relationships. By integrating KG with RAG, LLMs can dynamically access
and utilize the most relevant and up-to-date knowledge during response
generation. This hybrid approach bridges the gap between structured knowledge
representation and the generative capabilities of LLMs, significantly enhancing
accuracy, adaptability, and domain-specific comprehension. Our results
demonstrate the effectiveness of the KG-RAG framework in addressing complex
technical queries with precision. The proposed KG-RAG model attained an
accuracy of 88% for question answering tasks on a frequently used
telecom-specific dataset, compared to 82% for the RAG-only and 48% for the
LLM-only approaches.",http://arxiv.org/abs/2503.24245v2,3/31/25,"Dun Yuan, Hao Zhou, Di Wu, Xue Liu, Hao Chen, Yan Xin, Jianzhong, Zhang"
153,How to Build an Adaptive AI Tutor for Any Course Using Knowledge Graph-Enhanced Retrieval-Augmented Generation (KG-RAG),"Integrating Large Language Models (LLMs) in Intelligent Tutoring Systems
(ITS) presents transformative opportunities for personalized education.
However, current implementations face two critical challenges: maintaining
factual accuracy and delivering coherent, context-aware instruction. While
Retrieval-Augmented Generation (RAG) partially addresses these issues, its
reliance on pure semantic similarity limits its effectiveness in educational
contexts where conceptual relationships are crucial. This paper introduces
Knowledge Graph-enhanced Retrieval-Augmented Generation (KG-RAG), a novel
framework that integrates structured knowledge representation with
context-aware retrieval to enable more effective AI tutoring. We present three
key contributions: (1) a novel architecture that grounds AI responses in
structured domain knowledge, (2) empirical validation through controlled
experiments (n=76) demonstrating significant learning improvements (35%
increase in assessment scores, p<0.001), and (3) a comprehensive implementation
framework addressing practical deployment considerations. These results
establish KG-RAG as a robust solution for developing adaptable AI tutoring
systems across diverse educational contexts.",http://arxiv.org/abs/2311.17696v7,11/29/23,"Chenxi Dong, Yimin Yuan, Kan Chen, Shupei Cheng, Chujie Wen"
154,DynaGRAG | Exploring the Topology of Information for Advancing Language Understanding and Generation in Graph Retrieval-Augmented Generation,"Graph Retrieval-Augmented Generation (GRAG or Graph RAG) architectures aim to
enhance language understanding and generation by leveraging external knowledge.
However, effectively capturing and integrating the rich semantic information
present in textual and structured data remains a challenge. To address this, a
novel GRAG framework, Dynamic Graph Retrieval-Agumented Generation (DynaGRAG),
is proposed to focus on enhancing subgraph representation and diversity within
the knowledge graph. By improving graph density, capturing entity and relation
information more effectively, and dynamically prioritizing relevant and diverse
subgraphs and information within them, the proposed approach enables a more
comprehensive understanding of the underlying semantic structure. This is
achieved through a combination of de-duplication processes, two-step mean
pooling of embeddings, query-aware retrieval considering unique nodes, and a
Dynamic Similarity-Aware BFS (DSA-BFS) traversal algorithm. Integrating Graph
Convolutional Networks (GCNs) and Large Language Models (LLMs) through hard
prompting further enhances the learning of rich node and edge representations
while preserving the hierarchical subgraph structure. Experimental results
demonstrate the effectiveness of DynaGRAG, showcasing the significance of
enhanced subgraph representation and diversity for improved language
understanding and generation.",http://arxiv.org/abs/2412.18644v3,12/24/24,Karishma Thakrar
155,RAG-based Explainable Prediction of Road Users Behaviors for Automated Driving using Knowledge Graphs and Large Language Models,"Prediction of road users' behaviors in the context of autonomous driving has
gained considerable attention by the scientific community in the last years.
Most works focus on predicting behaviors based on kinematic information alone,
a simplification of the reality since road users are humans, and as such they
are highly influenced by their surrounding context. In addition, a large
plethora of research works rely on powerful Deep Learning techniques, which
exhibit high performance metrics in prediction tasks but may lack the ability
to fully understand and exploit the contextual semantic information contained
in the road scene, not to mention their inability to provide explainable
predictions that can be understood by humans. In this work, we propose an
explainable road users' behavior prediction system that integrates the
reasoning abilities of Knowledge Graphs (KG) and the expressiveness
capabilities of Large Language Models (LLM) by using Retrieval Augmented
Generation (RAG) techniques. For that purpose, Knowledge Graph Embeddings (KGE)
and Bayesian inference are combined to allow the deployment of a fully
inductive reasoning system that enables the issuing of predictions that rely on
legacy information contained in the graph as well as on current evidence
gathered in real time by onboard sensors. Two use cases have been implemented
following the proposed approach: 1) Prediction of pedestrians' crossing
actions; 2) Prediction of lane change maneuvers. In both cases, the performance
attained surpasses the current state of the art in terms of anticipation and
F1-score, showing a promising avenue for future research in this field.",http://arxiv.org/abs/2405.00449v1,5/1/24,"Mohamed Manzour Hussien, Angie Nataly Melo, Augusto Luis Ballardini, Carlota Salinas Maldonado, Rubn Izquierdo, Miguel ngel Sotelo"
156,From Documents to Dialogue: Building KG-RAG Enhanced AI Assistants,"The Adobe Experience Platform AI Assistant is a conversational tool that
enables organizations to interact seamlessly with proprietary enterprise data
through a chatbot. However, due to access restrictions, Large Language Models
(LLMs) cannot retrieve these internal documents, limiting their ability to
generate accurate zero-shot responses. To overcome this limitation, we use a
Retrieval-Augmented Generation (RAG) framework powered by a Knowledge Graph
(KG) to retrieve relevant information from external knowledge sources, enabling
LLMs to answer questions over private or previously unseen document
collections. In this paper, we propose a novel approach for building a
high-quality, low-noise KG. We apply several techniques, including incremental
entity resolution using seed concepts, similarity-based filtering to
deduplicate entries, assigning confidence scores to entity-relation pairs to
filter for high-confidence pairs, and linking facts to source documents for
provenance. Our KG-RAG system retrieves relevant tuples, which are added to the
user prompts context before being sent to the LLM generating the response. Our
evaluation demonstrates that this approach significantly enhances response
relevance, reducing irrelevant answers by over 50% and increasing fully
relevant answers by 88% compared to the existing production system.",http://arxiv.org/abs/2502.15237v1,2/21/25,"Manisha Mukherjee, Sungchul Kim, Xiang Chen, Dan Luo, Tong Yu, Tung Mai"
157,Towards Graph-hop Retrieval and Reasoning in Complex Question Answering over Textual Database,"In Textual question answering (TQA) systems, complex questions often require
retrieving multiple textual fact chains with multiple reasoning steps. While
existing benchmarks are limited to single-chain or single-hop retrieval
scenarios. In this paper, we propose to conduct Graph-Hop -- a novel
multi-chains and multi-hops retrieval and reasoning paradigm in complex
question answering. We construct a new benchmark called ReasonGraphQA, which
provides explicit and fine-grained evidence graphs for complex questions to
support interpretable reasoning, comprehensive and detailed reasoning. And
ReasonGraphQA also shows an advantage in reasoning diversity and scale.
Moreover, We propose a strong graph-hop baseline called Bidirectional Graph
Retrieval (BGR) method for generating an explanation graph of textual evidence
in knowledge reasoning and question answering. We have thoroughly evaluated
existing evidence retrieval and reasoning models on the ReasonGraphQA.
Experiments highlight Graph-Hop is a promising direction for answering complex
questions, but it still has certain limitations. We have further studied
mitigation strategies to meet these challenges and discuss future directions.",http://arxiv.org/abs/2305.14211v1,5/23/23,"Minjun Zhu, Yixuan Weng, Shizhu He, Kang Liu, Jun Zhao"
158,Worse than Zero-shot? A Fact-Checking Dataset for Evaluating the Robustness of RAG Against Misleading Retrievals,"Retrieval-augmented generation (RAG) has shown impressive capabilities in
mitigating hallucinations in large language models (LLMs). However, LLMs
struggle to handle misleading retrievals and often fail to maintain their own
reasoning when exposed to conflicting or selectively-framed evidence, making
them vulnerable to real-world misinformation. In such real-world retrieval
scenarios, misleading and conflicting information is rampant, particularly in
the political domain, where evidence is often selectively framed, incomplete,
or polarized. However, existing RAG benchmarks largely assume a clean retrieval
setting, where models succeed by accurately retrieving and generating answers
from gold-standard documents. This assumption fails to align with real-world
conditions, leading to an overestimation of RAG system performance. To bridge
this gap, we introduce RAGuard, a fact-checking dataset designed to evaluate
the robustness of RAG systems against misleading retrievals. Unlike prior
benchmarks that rely on synthetic noise, our dataset constructs its retrieval
corpus from Reddit discussions, capturing naturally occurring misinformation.
It categorizes retrieved evidence into three types: supporting, misleading, and
irrelevant, providing a realistic and challenging testbed for assessing how
well RAG systems navigate different retrieval information. Our benchmark
experiments reveal that when exposed to misleading retrievals, all tested
LLM-powered RAG systems perform worse than their zero-shot baselines (i.e., no
retrieval at all), highlighting their susceptibility to noisy environments. To
the best of our knowledge, RAGuard is the first benchmark to systematically
assess RAG robustness against misleading evidence. We expect this benchmark
will drive future research toward improving RAG systems beyond idealized
datasets, making them more reliable for real-world applications.",http://arxiv.org/abs/2502.16101v2,2/22/25,"Linda Zeng, Rithwik Gupta, Divij Motwani, Diji Yang, Yi Zhang"
159,From RAG to Memory: Non-Parametric Continual Learning for Large Language Models,"Our ability to continuously acquire, organize, and leverage knowledge is a
key feature of human intelligence that AI systems must approximate to unlock
their full potential. Given the challenges in continual learning with large
language models (LLMs), retrieval-augmented generation (RAG) has become the
dominant way to introduce new information. However, its reliance on vector
retrieval hinders its ability to mimic the dynamic and interconnected nature of
human long-term memory. Recent RAG approaches augment vector embeddings with
various structures like knowledge graphs to address some of these gaps, namely
sense-making and associativity. However, their performance on more basic
factual memory tasks drops considerably below standard RAG. We address this
unintended deterioration and propose HippoRAG 2, a framework that outperforms
standard RAG comprehensively on factual, sense-making, and associative memory
tasks. HippoRAG 2 builds upon the Personalized PageRank algorithm used in
HippoRAG and enhances it with deeper passage integration and more effective
online use of an LLM. This combination pushes this RAG system closer to the
effectiveness of human long-term memory, achieving a 7% improvement in
associative memory tasks over the state-of-the-art embedding model while also
exhibiting superior factual knowledge and sense-making memory capabilities.
This work paves the way for non-parametric continual learning for LLMs. Our
code and data will be released at https://github.com/OSU-NLP-Group/HippoRAG.",http://arxiv.org/abs/2502.14802v1,2/20/25,"Bernal Jimnez Gutirrez, Yiheng Shu, Weijian Qi, Sizhe Zhou, Yu Su"
160,StreamingRAG: Real-time Contextual Retrieval and Generation Framework,"Extracting real-time insights from multi-modal data streams from various
domains such as healthcare, intelligent transportation, and satellite remote
sensing remains a challenge. High computational demands and limited knowledge
scope restrict the applicability of Multi-Modal Large Language Models (MM-LLMs)
on these data streams. Traditional Retrieval-Augmented Generation (RAG) systems
address knowledge limitations of these models, but suffer from slow
preprocessing, making them unsuitable for real-time analysis. We propose
StreamingRAG, a novel RAG framework designed for streaming data. StreamingRAG
constructs evolving knowledge graphs capturing scene-object-entity
relationships in real-time. The knowledge graph achieves temporal-aware scene
representations using MM-LLMs and enables timely responses for specific events
or user queries. StreamingRAG addresses limitations in existing methods,
achieving significant improvements in real-time analysis (5-6x faster
throughput), contextual accuracy (through a temporal knowledge graph), and
reduced resource consumption (using lightweight models by 2-3x).",http://arxiv.org/abs/2501.14101v1,1/23/25,"Murugan Sankaradas, Ravi K Rajendran, Srimat T Chakradhar"
