docid,title,abstract,url,published,authors
0,RAG vs. GraphRAG: A Systematic Evaluation and Key Insights,"Retrieval-Augmented Generation (RAG) enhances the performance of LLMs across
various tasks by retrieving relevant information from external sources,
particularly on text-based data. For structured data, such as knowledge graphs,
GraphRAG has been widely used to retrieve relevant information. However, recent
studies have revealed that structuring implicit knowledge from text into graphs
can benefit certain tasks, extending the application of GraphRAG from graph
data to general text-based data. Despite their successful extensions, most
applications of GraphRAG for text data have been designed for specific tasks
and datasets, lacking a systematic evaluation and comparison between RAG and
GraphRAG on widely used text-based benchmarks. In this paper, we systematically
evaluate RAG and GraphRAG on well-established benchmark tasks, such as Question
Answering and Query-based Summarization. Our results highlight the distinct
strengths of RAG and GraphRAG across different tasks and evaluation
perspectives. Inspired by these observations, we investigate strategies to
integrate their strengths to improve downstream tasks. Additionally, we provide
an in-depth discussion of the shortcomings of current GraphRAG approaches and
outline directions for future research.",http://arxiv.org/abs/2502.11371v1,2/17/25,"Haoyu Han, Harry Shomer, Yu Wang, Yongjia Lei, Kai Guo, Zhigang Hua, Bo Long, Hui Liu, Jiliang Tang"
1,Empowering GraphRAG with Knowledge Filtering and Integration,"In recent years, large language models (LLMs) have revolutionized the field
of natural language processing. However, they often suffer from knowledge gaps
and hallucinations. Graph retrieval-augmented generation (GraphRAG) enhances
LLM reasoning by integrating structured knowledge from external graphs.
However, we identify two key challenges that plague GraphRAG:(1) Retrieving
noisy and irrelevant information can degrade performance and (2)Excessive
reliance on external knowledge suppresses the model's intrinsic reasoning. To
address these issues, we propose GraphRAG-FI (Filtering and Integration),
consisting of GraphRAG-Filtering and GraphRAG-Integration. GraphRAG-Filtering
employs a two-stage filtering mechanism to refine retrieved information.
GraphRAG-Integration employs a logits-based selection strategy to balance
external knowledge from GraphRAG with the LLM's intrinsic reasoning,reducing
over-reliance on retrievals. Experiments on knowledge graph QA tasks
demonstrate that GraphRAG-FI significantly improves reasoning performance
across multiple backbone models, establishing a more reliable and effective
GraphRAG framework.",http://arxiv.org/abs/2503.13804v1,3/18/25,"Kai Guo, Harry Shomer, Shenglai Zeng, Haoyu Han, Yu Wang, Jiliang Tang"
2,A Survey of Graph Retrieval-Augmented Generation for Customized Large Language Models,"Large language models (LLMs) have demonstrated remarkable capabilities in a
wide range of tasks, yet their application to specialized domains remains
challenging due to the need for deep expertise. Retrieval-augmented generation
(RAG) has emerged as a promising solution to customize LLMs for professional
fields by seamlessly integrating external knowledge bases, enabling real-time
access to domain-specific expertise during inference. Despite its potential,
traditional RAG systems, based on flat text retrieval, face three critical
challenges: (i) complex query understanding in professional contexts, (ii)
difficulties in knowledge integration across distributed sources, and (iii)
system efficiency bottlenecks at scale. This survey presents a systematic
analysis of Graph-based Retrieval-Augmented Generation (GraphRAG), a new
paradigm that revolutionizes domain-specific LLM applications. GraphRAG
addresses traditional RAG limitations through three key innovations: (i)
graph-structured knowledge representation that explicitly captures entity
relationships and domain hierarchies, (ii) efficient graph-based retrieval
techniques that enable context-preserving knowledge retrieval with multihop
reasoning ability, and (iii) structure-aware knowledge integration algorithms
that leverage retrieved knowledge for accurate and logical coherent generation
of LLMs. In this survey, we systematically analyze the technical foundations of
GraphRAG and examine current implementations across various professional
domains, identifying key technical challenges and promising research
directions. All the related resources of GraphRAG, including research papers,
open-source data, and projects, are collected for the community in
\textcolor{blue}{\url{https://github.com/DEEP-PolyU/Awesome-GraphRAG}}.",http://arxiv.org/abs/2501.13958v1,1/21/25,"Qinggang Zhang, Shengyuan Chen, Yuanchen Bei, Zheng Yuan, Huachi Zhou, Zijin Hong, Junnan Dong, Hao Chen, Yi Chang, Xiao Huang"
3,RAKG:Document-level Retrieval Augmented Knowledge Graph Construction,"With the rise of knowledge graph based retrieval-augmented generation (RAG)
techniques such as GraphRAG and Pike-RAG, the role of knowledge graphs in
enhancing the reasoning capabilities of large language models (LLMs) has become
increasingly prominent. However, traditional Knowledge Graph Construction (KGC)
methods face challenges like complex entity disambiguation, rigid schema
definition, and insufficient cross-document knowledge integration. This paper
focuses on the task of automatic document-level knowledge graph construction.
It proposes the Document-level Retrieval Augmented Knowledge Graph Construction
(RAKG) framework. RAKG extracts pre-entities from text chunks and utilizes
these pre-entities as queries for RAG, effectively addressing the issue of
long-context forgetting in LLMs and reducing the complexity of Coreference
Resolution. In contrast to conventional KGC methods, RAKG more effectively
captures global information and the interconnections among disparate nodes,
thereby enhancing the overall performance of the model. Additionally, we
transfer the RAG evaluation framework to the KGC field and filter and evaluate
the generated knowledge graphs, thereby avoiding incorrectly generated entities
and relationships caused by hallucinations in LLMs. We further developed the
MINE dataset by constructing standard knowledge graphs for each article and
experimentally validated the performance of RAKG. The results show that RAKG
achieves an accuracy of 95.91 % on the MINE dataset, a 6.2 % point improvement
over the current best baseline, GraphRAG (89.71 %). The code is available at
https://github.com/LMMApplication/RAKG.",http://arxiv.org/abs/2504.09823v1,4/14/25,"Hairong Zhang, Jiaheng Si, Guohang Yan, Boyuan Qi, Pinlong Cai, Song Mao, Ding Wang, Botian Shi"
4,GFM-RAG: Graph Foundation Model for Retrieval Augmented Generation,"Retrieval-augmented generation (RAG) has proven effective in integrating
knowledge into large language models (LLMs). However, conventional RAGs
struggle to capture complex relationships between pieces of knowledge, limiting
their performance in intricate reasoning that requires integrating knowledge
from multiple sources. Recently, graph-enhanced retrieval augmented generation
(GraphRAG) builds graph structure to explicitly model these relationships,
enabling more effective and efficient retrievers. Nevertheless, its performance
is still hindered by the noise and incompleteness within the graph structure.
To address this, we introduce GFM-RAG, a novel graph foundation model (GFM) for
retrieval augmented generation. GFM-RAG is powered by an innovative graph
neural network that reasons over graph structure to capture complex
query-knowledge relationships. The GFM with 8M parameters undergoes a two-stage
training process on large-scale datasets, comprising 60 knowledge graphs with
over 14M triples and 700k documents. This results in impressive performance and
generalizability for GFM-RAG, making it the first graph foundation model
applicable to unseen datasets for retrieval without any fine-tuning required.
Extensive experiments on three multi-hop QA datasets and seven domain-specific
RAG datasets demonstrate that GFM-RAG achieves state-of-the-art performance
while maintaining efficiency and alignment with neural scaling laws,
highlighting its potential for further improvement.",http://arxiv.org/abs/2502.01113v1,2/3/25,"Linhao Luo, Zicheng Zhao, Gholamreza Haffari, Dinh Phung, Chen Gong, Shirui Pan"
5,GraphRAFT: Retrieval Augmented Fine-Tuning for Knowledge Graphs on Graph Databases,"Large language models have shown remarkable language processing and reasoning
ability but are prone to hallucinate when asked about private data.
Retrieval-augmented generation (RAG) retrieves relevant data that fit into an
LLM's context window and prompts the LLM for an answer. GraphRAG extends this
approach to structured Knowledge Graphs (KGs) and questions regarding entities
multiple hops away. The majority of recent GraphRAG methods either overlook the
retrieval step or have ad hoc retrieval processes that are abstract or
inefficient. This prevents them from being adopted when the KGs are stored in
graph databases supporting graph query languages. In this work, we present
GraphRAFT, a retrieve-and-reason framework that finetunes LLMs to generate
provably correct Cypher queries to retrieve high-quality subgraph contexts and
produce accurate answers. Our method is the first such solution that can be
taken off-the-shelf and used on KGs stored in native graph DBs. Benchmarks
suggest that our method is sample-efficient and scales with the availability of
training data. Our method achieves significantly better results than all
state-of-the-art models across all four standard metrics on two challenging
Q\&As on large text-attributed KGs.",http://arxiv.org/abs/2504.05478v1,4/7/25,"Alfred Clemedtson, Borun Shi"
6,FG-RAG: Enhancing Query-Focused Summarization with Context-Aware Fine-Grained Graph RAG,"Retrieval-Augmented Generation (RAG) enables large language models to provide
more precise and pertinent responses by incorporating external knowledge. In
the Query-Focused Summarization (QFS) task, GraphRAG-based approaches have
notably enhanced the comprehensiveness and diversity of generated responses.
However, existing GraphRAG-based approaches predominantly focus on
coarse-grained information summarization without being aware of the specific
query, and the retrieved content lacks sufficient contextual information to
generate comprehensive responses. To address the deficiencies of current RAG
systems, we propose Context-Aware Fine-Grained Graph RAG (FG-RAG) to enhance
the performance of the QFS task. FG-RAG employs Context-Aware Entity Expansion
in graph retrieval to expand the coverage of retrieved entities in the graph,
thus providing enough contextual information for the retrieved content.
Furthermore, FG-RAG utilizes Query-Level Fine-Grained Summarization to
incorporate fine-grained details during response generation, enhancing query
awareness for the generated summarization. Our evaluation demonstrates that
FG-RAG outperforms other RAG systems in multiple metrics of comprehensiveness,
diversity, and empowerment when handling the QFS task. Our implementation is
available at https://github.com/BuptWululu/FG-RAG.",http://arxiv.org/abs/2504.07103v1,3/13/25,"Yubin Hong, Chaofan Li, Jingyi Zhang, Yingxia Shao"
7,Graph Retrieval-Augmented Generation: A Survey,"Recently, Retrieval-Augmented Generation (RAG) has achieved remarkable
success in addressing the challenges of Large Language Models (LLMs) without
necessitating retraining. By referencing an external knowledge base, RAG
refines LLM outputs, effectively mitigating issues such as ``hallucination'',
lack of domain-specific knowledge, and outdated information. However, the
complex structure of relationships among different entities in databases
presents challenges for RAG systems. In response, GraphRAG leverages structural
information across entities to enable more precise and comprehensive retrieval,
capturing relational knowledge and facilitating more accurate, context-aware
responses. Given the novelty and potential of GraphRAG, a systematic review of
current technologies is imperative. This paper provides the first comprehensive
overview of GraphRAG methodologies. We formalize the GraphRAG workflow,
encompassing Graph-Based Indexing, Graph-Guided Retrieval, and Graph-Enhanced
Generation. We then outline the core technologies and training methods at each
stage. Additionally, we examine downstream tasks, application domains,
evaluation methodologies, and industrial use cases of GraphRAG. Finally, we
explore future research directions to inspire further inquiries and advance
progress in the field. In order to track recent progress in this field, we set
up a repository at \url{https://github.com/pengboci/GraphRAG-Survey}.",http://arxiv.org/abs/2408.08921v2,8/15/24,"Boci Peng, Yun Zhu, Yongchao Liu, Xiaohe Bo, Haizhou Shi, Chuntao Hong, Yan Zhang, Siliang Tang"
8,Retrieval-Augmented Generation with Graphs (GraphRAG),"Retrieval-augmented generation (RAG) is a powerful technique that enhances
downstream task execution by retrieving additional information, such as
knowledge, skills, and tools from external sources. Graph, by its intrinsic
""nodes connected by edges"" nature, encodes massive heterogeneous and relational
information, making it a golden resource for RAG in tremendous real-world
applications. As a result, we have recently witnessed increasing attention on
equipping RAG with Graph, i.e., GraphRAG. However, unlike conventional RAG,
where the retriever, generator, and external data sources can be uniformly
designed in the neural-embedding space, the uniqueness of graph-structured
data, such as diverse-formatted and domain-specific relational knowledge, poses
unique and significant challenges when designing GraphRAG for different
domains. Given the broad applicability, the associated design challenges, and
the recent surge in GraphRAG, a systematic and up-to-date survey of its key
concepts and techniques is urgently desired. Following this motivation, we
present a comprehensive and up-to-date survey on GraphRAG. Our survey first
proposes a holistic GraphRAG framework by defining its key components,
including query processor, retriever, organizer, generator, and data source.
Furthermore, recognizing that graphs in different domains exhibit distinct
relational patterns and require dedicated designs, we review GraphRAG
techniques uniquely tailored to each domain. Finally, we discuss research
challenges and brainstorm directions to inspire cross-disciplinary
opportunities. Our survey repository is publicly maintained at
https://github.com/Graph-RAG/GraphRAG/.",http://arxiv.org/abs/2501.00309v2,12/31/24,"Haoyu Han, Yu Wang, Harry Shomer, Kai Guo, Jiayuan Ding, Yongjia Lei, Mahantesh Halappanavar, Ryan A Rossi, Subhabrata Mukherjee, Xianfeng Tang, Qi He, Zhigang Hua, Bo Long, Tong Zhao, Neil Shah, Amin Javari, Yinglong Xia, Jiliang Tang"
9,LEGO-GraphRAG: Modularizing Graph-based Retrieval-Augmented Generation for Design Space Exploration,"GraphRAG integrates (knowledge) graphs with large language models (LLMs) to
improve reasoning accuracy and contextual relevance. Despite its promising
applications and strong relevance to multiple research communities, such as
databases and natural language processing, GraphRAG currently lacks modular
workflow analysis, systematic solution frameworks, and insightful empirical
studies. To bridge these gaps, we propose LEGO-GraphRAG, a modular framework
that enables: 1) fine-grained decomposition of the GraphRAG workflow, 2)
systematic classification of existing techniques and implemented GraphRAG
instances, and 3) creation of new GraphRAG instances. Our framework facilitates
comprehensive empirical studies of GraphRAG on large-scale real-world graphs
and diverse query sets, revealing insights into balancing reasoning quality,
runtime efficiency, and token or GPU cost, that are essential for building
advanced GraphRAG systems.",http://arxiv.org/abs/2411.05844v2,11/6/24,"Yukun Cao, Zengyi Gao, Zhiyang Li, Xike Xie, Kevin Zhou, Jianliang Xu"
10,"Generating Knowledge Graphs from Large Language Models: A Comparative Study of GPT-4, LLaMA 2, and BERT","Knowledge Graphs (KGs) are essential for the functionality of GraphRAGs, a
form of Retrieval-Augmented Generative Systems (RAGs) that excel in tasks
requiring structured reasoning and semantic understanding. However, creating
KGs for GraphRAGs remains a significant challenge due to accuracy and
scalability limitations of traditional methods. This paper introduces a novel
approach leveraging large language models (LLMs) like GPT-4, LLaMA 2 (13B), and
BERT to generate KGs directly from unstructured data, bypassing traditional
pipelines. Using metrics such as Precision, Recall, F1-Score, Graph Edit
Distance, and Semantic Similarity, we evaluate the models' ability to generate
high-quality KGs. Results demonstrate that GPT-4 achieves superior semantic
fidelity and structural accuracy, LLaMA 2 excels in lightweight,
domain-specific graphs, and BERT provides insights into challenges in
entity-relationship modeling. This study underscores the potential of LLMs to
streamline KG creation and enhance GraphRAG accessibility for real-world
applications, while setting a foundation for future advancements.",http://arxiv.org/abs/2412.07412v1,12/10/24,"Ahan Bhatt, Nandan Vaghela, Kush Dudhia"
11,"Beyond Single Pass, Looping Through Time: KG-IRAG with Iterative Knowledge Retrieval","Graph Retrieval-Augmented Generation (GraphRAG) has proven highly effective
in enhancing the performance of Large Language Models (LLMs) on tasks that
require external knowledge. By leveraging Knowledge Graphs (KGs), GraphRAG
improves information retrieval for complex reasoning tasks, providing more
precise and comprehensive retrieval and generating more accurate responses to
QAs. However, most RAG methods fall short in addressing multi-step reasoning,
particularly when both information extraction and inference are necessary. To
address this limitation, this paper presents Knowledge Graph-Based Iterative
Retrieval-Augmented Generation (KG-IRAG), a novel framework that integrates KGs
with iterative reasoning to improve LLMs' ability to handle queries involving
temporal and logical dependencies. Through iterative retrieval steps, KG-IRAG
incrementally gathers relevant data from external KGs, enabling step-by-step
reasoning. The proposed approach is particularly suited for scenarios where
reasoning is required alongside dynamic temporal data extraction, such as
determining optimal travel times based on weather conditions or traffic
patterns. Experimental results show that KG-IRAG improves accuracy in complex
reasoning tasks by effectively integrating external knowledge with iterative,
logic-based retrieval. Additionally, three new datasets: weatherQA-Irish,
weatherQA-Sydney, and trafficQA-TFNSW, are formed to evaluate KG-IRAG's
performance, demonstrating its potential beyond traditional RAG applications.",http://arxiv.org/abs/2503.14234v3,3/18/25,"Ruiyi Yang, Hao Xue, Imran Razzak, Hakim Hacid, Flora D Salim"
12,GraphRAG under Fire,"GraphRAG advances retrieval-augmented generation (RAG) by structuring
external knowledge as multi-scale knowledge graphs, enabling language models to
integrate both broad context and granular details in their generation. While
GraphRAG has demonstrated success across domains, its security implications
remain largely unexplored. To bridge this gap, this work examines GraphRAG's
vulnerability to poisoning attacks, uncovering an intriguing security paradox:
compared to conventional RAG, GraphRAG's graph-based indexing and retrieval
enhance resilience against simple poisoning attacks; yet, the same features
also create new attack surfaces. We present GRAGPoison, a novel attack that
exploits shared relations in the underlying knowledge graph to craft poisoning
text capable of compromising multiple queries simultaneously. GRAGPoison
employs three key strategies: i) relation injection to introduce false
knowledge, ii) relation enhancement to amplify poisoning influence, and iii)
narrative generation to embed malicious content within coherent text. Empirical
evaluation across diverse datasets and models shows that GRAGPoison
substantially outperforms existing attacks in terms of effectiveness (up to
98\% success rate) and scalability (using less than 68\% poisoning text) on
various GraphRAG-based systems. We also explore potential defensive measures
and their limitations, identifying promising directions for future research.",http://arxiv.org/abs/2501.14050v2,1/23/25,"Jiacheng Liang, Yuhui Wang, Changjiang Li, Rongyi Zhu, Tanqiu Jiang, Neil Gong, Ting Wang"
13,When Graph Meets Retrieval Augmented Generation for Wireless Networks: A Tutorial and Case Study,"The rapid development of next-generation networking technologies underscores
their transformative role in revolutionizing modern communication systems,
enabling faster, more reliable, and highly interconnected solutions. However,
such development has also brought challenges to network optimizations. Thanks
to the emergence of Large Language Models (LLMs) in recent years, tools
including Retrieval Augmented Generation (RAG) have been developed and applied
in various fields including networking, and have shown their effectiveness.
Taking one step further, the integration of knowledge graphs into RAG
frameworks further enhanced the performance of RAG in networking applications
such as Intent-Driven Networks (IDNs) and spectrum knowledge maps by providing
more contextually relevant responses through more accurate retrieval of related
network information. This paper introduces the RAG framework that integrates
knowledge graphs in its database and explores such framework's application in
networking. We begin by exploring RAG's applications in networking and the
limitations of conventional RAG and present the advantages that knowledge
graphs' structured knowledge representation brings to the retrieval and
generation processes. Next, we propose a detailed GraphRAG-based framework for
networking, including a step-by-step tutorial on its construction. Our
evaluation through a case study on channel gain prediction demonstrates
GraphRAG's enhanced capability in generating accurate, contextually rich
responses, surpassing traditional RAG models. Finally, we discuss key future
directions for applying knowledge-graphs-empowered RAG frameworks in
networking, including robust updates, mitigation of hallucination, and enhanced
security measures for networking applications.",http://arxiv.org/abs/2412.07189v1,12/10/24,"Yang Xiong, Ruichen Zhang, Yinqiu Liu, Dusit Niyato, Zehui Xiong, YingChang Liang, Shiwen Mao"
14,GTR: Graph-Table-RAG for Cross-Table Question Answering,"Beyond pure text, a substantial amount of knowledge is stored in tables. In
real-world scenarios, user questions often require retrieving answers that are
distributed across multiple tables. GraphRAG has recently attracted much
attention for enhancing LLMs' reasoning capabilities by organizing external
knowledge to address ad-hoc and complex questions, exemplifying a promising
direction for cross-table question answering. In this paper, to address the
current gap in available data, we first introduce a multi-table benchmark,
MutliTableQA, comprising 60k tables and 25k user queries collected from
real-world sources. Then, we propose the first Graph-Table-RAG framework,
namely GTR, which reorganizes table corpora into a heterogeneous graph, employs
a hierarchical coarse-to-fine retrieval process to extract the most relevant
tables, and integrates graph-aware prompting for downstream LLMs' tabular
reasoning. Extensive experiments show that GTR exhibits superior cross-table
question-answering performance while maintaining high deployment efficiency,
demonstrating its real-world practical applicability.",http://arxiv.org/abs/2504.01346v3,4/2/25,"Jiaru Zou, Dongqi Fu, Sirui Chen, Xinrui He, Zihao Li, Yada Zhu, Jiawei Han, Jingrui He"
15,HyperGraphRAG: Retrieval-Augmented Generation via Hypergraph-Structured Knowledge Representation,"Standard Retrieval-Augmented Generation (RAG) relies on chunk-based
retrieval, whereas GraphRAG advances this approach by graph-based knowledge
representation. However, existing graph-based RAG approaches are constrained by
binary relations, as each edge in an ordinary graph connects only two entities,
limiting their ability to represent the n-ary relations (n >= 2) in real-world
knowledge. In this work, we propose HyperGraphRAG, a novel hypergraph-based RAG
method that represents n-ary relational facts via hyperedges, and consists of
knowledge hypergraph construction, retrieval, and generation. Experiments
across medicine, agriculture, computer science, and law demonstrate that
HyperGraphRAG outperforms both standard RAG and previous graph-based RAG
methods in answer accuracy, retrieval efficiency, and generation quality.",http://arxiv.org/abs/2503.21322v2,3/27/25,"Haoran Luo, Haihong E, Guanting Chen, Yandan Zheng, Xiaobao Wu, Yikai Guo, Qika Lin, Yu Feng, Zemin Kuang, Meina Song, Yifan Zhu, Luu Anh Tuan"
