docid,title,abstract,url,published,authors
64,CoT-RAG: Integrating Chain of Thought and Retrieval-Augmented Generation to Enhance Reasoning in Large Language Models,"Chain-of-thought (CoT) reasoning boosts large language models' (LLMs)
performance on complex tasks but faces two key limitations: a lack of
reliability when solely relying on LLM-generated reasoning chains and
interference from natural language reasoning steps with the models' inference
process, also known as the inference logic of LLMs. To address these issues, we
propose CoT-RAG, a novel reasoning framework with three key designs: (i)
Knowledge Graph-driven CoT Generation,featuring knowledge graphs to modulate
reasoning chain generation of LLMs, thereby enhancing reasoning credibility;
(ii) Learnable Knowledge Case-aware RAG, which incorporates retrieval-augmented
generation (RAG) into knowledge graphs to retrieve relevant sub-cases and
sub-descriptions, providing LLMs with learnable information; (iii)
Pseudo-Program Prompting Execution, which promotes greater logical rigor by
guiding LLMs to execute reasoning tasks as pseudo-programs. Evaluations on nine
public datasets spanning three reasoning tasks reveal significant accuracy
gains--ranging from 4.0% to 44.3%--over state-of-the-art methods. Furthermore,
tests on four domain-specific datasets demonstrate exceptional accuracy and
efficient execution, underscoring its practical applicability and scalability.",http://arxiv.org/abs/2504.13534v2,4/18/25,"Feiyang Li, Peng Fang, Zhan Shi, Arijit Khan, Fang Wang, Dan Feng, Weihao Wang, Xin Zhang, Yongjian Cui"
65,Learning to Erase Private Knowledge from Multi-Documents for Retrieval-Augmented Large Language Models,"Retrieval-Augmented Generation (RAG) is a promising technique for applying
LLMs to proprietary domains. However, retrieved documents may contain sensitive
knowledge, posing risks of privacy leakage in generative results. Thus,
effectively erasing private information from retrieved documents is a key
challenge for RAG. Unlike traditional text anonymization, RAG should consider:
(1) the inherent multi-document reasoning may face de-anonymization attacks;
(2) private knowledge varies by scenarios, so users should be allowed to
customize which information to erase; (3) preserving sufficient publicly
available knowledge for generation tasks. This paper introduces the privacy
erasure task for RAG and proposes Eraser4RAG, a private knowledge eraser which
effectively removes user-defined private knowledge from documents while
preserving sufficient public knowledge for generation. Specifically, we first
construct a global knowledge graph to identify potential knowledge across
documents, aiming to defend against de-anonymization attacks. Then we randomly
split it into private and public sub-graphs, and fine-tune Flan-T5 to rewrite
the retrieved documents excluding private triples. Finally, PPO algorithm
optimizes the rewriting model to minimize private triples and maximize public
triples retention. Experiments on four QA datasets demonstrate that Eraser4RAG
achieves superior erase performance than GPT-4o.",http://arxiv.org/abs/2504.09910v1,4/14/25,"Yujing Wang, Hainan Zhang, Liang Pang, Yongxin Tong, Binghui Guo, Hongwei Zheng, Zhiming Zheng"
66,SubGCache: Accelerating Graph-based RAG with Subgraph-level KV Cache,"Graph-based retrieval-augmented generation (RAG) enables large language
models (LLMs) to incorporate structured knowledge via graph retrieval as
contextual input, enhancing more accurate and context-aware reasoning. We
observe that for different queries, it could retrieve similar subgraphs as
prompts, and thus we propose SubGCache, which aims to reduce inference latency
by reusing computation across queries with similar structural prompts (i.e.,
subgraphs). Specifically, SubGCache clusters queries based on subgraph
embeddings, constructs a representative subgraph for each cluster, and
pre-computes the key-value (KV) cache of the representative subgraph. For each
query with its retrieved subgraph within a cluster, it reuses the pre-computed
KV cache of the representative subgraph of the cluster without computing the KV
tensors again for saving computation. Experiments on two new datasets across
multiple LLM backbones and graph-based RAG frameworks demonstrate that
SubGCache consistently reduces inference latency with comparable and even
improved generation quality, achieving up to 6.68$\times$ reduction in
time-to-first-token (TTFT).",http://arxiv.org/abs/2505.10951v2,5/16/25,"Qiuyu Zhu, Liang Zhang, Qianxiong Xu, Cheng Long, Jie Zhang"
67,Plan*RAG: Efficient Test-Time Planning for Retrieval Augmented Generation,"We introduce Plan*RAG, a novel framework that enables structured multi-hop
reasoning in retrieval-augmented generation (RAG) through test-time reasoning
plan generation. While existing approaches such as ReAct maintain reasoning
chains within the language model's context window, we observe that this often
leads to plan fragmentation and execution failures. Our key insight is that by
isolating the reasoning plan as a directed acyclic graph (DAG) outside the LM's
working memory, we can enable (1) systematic exploration of reasoning paths,
(2) atomic subqueries enabling precise retrievals and grounding, and (3)
efficiency through parallel execution and bounded context window utilization.
Moreover, Plan*RAG's modular design allows it to be integrated with existing
RAG methods, thus providing a practical solution to improve current RAG
systems. On standard multi-hop reasoning benchmarks, Plan*RAG consistently
achieves improvements over recently proposed methods such as RQ-RAG and
Self-RAG, while maintaining comparable computational costs.",http://arxiv.org/abs/2410.20753v2,10/28/24,"Prakhar Verma, Sukruta Prakash Midigeshi, Gaurav Sinha, Arno Solin, Nagarajan Natarajan, Amit Sharma"
68,Knowledge Graph-Guided Retrieval Augmented Generation,"Retrieval-augmented generation (RAG) has emerged as a promising technology
for addressing hallucination issues in the responses generated by large
language models (LLMs). Existing studies on RAG primarily focus on applying
semantic-based approaches to retrieve isolated relevant chunks, which ignore
their intrinsic relationships. In this paper, we propose a novel Knowledge
Graph-Guided Retrieval Augmented Generation (KG$^2$RAG) framework that utilizes
knowledge graphs (KGs) to provide fact-level relationships between chunks,
improving the diversity and coherence of the retrieved results. Specifically,
after performing a semantic-based retrieval to provide seed chunks, KG$^2$RAG
employs a KG-guided chunk expansion process and a KG-based chunk organization
process to deliver relevant and important knowledge in well-organized
paragraphs. Extensive experiments conducted on the HotpotQA dataset and its
variants demonstrate the advantages of KG$^2$RAG compared to existing RAG-based
approaches, in terms of both response quality and retrieval quality.",http://arxiv.org/abs/2502.06864v1,2/8/25,"Xiangrong Zhu, Yuexiang Xie, Yi Liu, Yaliang Li, Wei Hu"
69,A Study on the Implementation Method of an Agent-Based Advanced RAG System Using Graph,"This study aims to improve knowledge-based question-answering (QA) systems by
overcoming the limitations of existing Retrieval-Augmented Generation (RAG)
models and implementing an advanced RAG system based on Graph technology to
develop high-quality generative AI services. While existing RAG models
demonstrate high accuracy and fluency by utilizing retrieved information, they
may suffer from accuracy degradation as they generate responses using
pre-loaded knowledge without reprocessing. Additionally, they cannot
incorporate real-time data after the RAG configuration stage, leading to issues
with contextual understanding and biased information. To address these
limitations, this study implemented an enhanced RAG system utilizing Graph
technology. This system is designed to efficiently search and utilize
information. Specifically, it employs LangGraph to evaluate the reliability of
retrieved information and synthesizes diverse data to generate more accurate
and enhanced responses. Furthermore, the study provides a detailed explanation
of the system's operation, key implementation steps, and examples through
implementation code and validation results, thereby enhancing the understanding
of advanced RAG technology. This approach offers practical guidelines for
implementing advanced RAG systems in corporate services, making it a valuable
resource for practical application.",http://arxiv.org/abs/2407.19994v3,7/29/24,Cheonsu Jeong
70,"Know3-RAG: A Knowledge-aware RAG Framework with Adaptive Retrieval, Generation, and Filtering","Recent advances in large language models (LLMs) have led to impressive
progress in natural language generation, yet their tendency to produce
hallucinated or unsubstantiated content remains a critical concern. To improve
factual reliability, Retrieval-Augmented Generation (RAG) integrates external
knowledge during inference. However, existing RAG systems face two major
limitations: (1) unreliable adaptive control due to limited external knowledge
supervision, and (2) hallucinations caused by inaccurate or irrelevant
references. To address these issues, we propose Know3-RAG, a knowledge-aware
RAG framework that leverages structured knowledge from knowledge graphs (KGs)
to guide three core stages of the RAG process, including retrieval, generation,
and filtering. Specifically, we introduce a knowledge-aware adaptive retrieval
module that employs KG embedding to assess the confidence of the generated
answer and determine retrieval necessity, a knowledge-enhanced reference
generation strategy that enriches queries with KG-derived entities to improve
generated reference relevance, and a knowledge-driven reference filtering
mechanism that ensures semantic alignment and factual accuracy of references.
Experiments on multiple open-domain QA benchmarks demonstrate that Know3-RAG
consistently outperforms strong baselines, significantly reducing
hallucinations and enhancing answer reliability.",http://arxiv.org/abs/2505.12662v1,5/19/25,"Xukai Liu, Ye Liu, Shiwen Wu, Yanghai Zhang, Yihao Yuan, Kai Zhang, Qi Liu"
71,MedRAG: Enhancing Retrieval-augmented Generation with Knowledge Graph-Elicited Reasoning for Healthcare Copilot,"Retrieval-augmented generation (RAG) is a well-suited technique for
retrieving privacy-sensitive Electronic Health Records (EHR). It can serve as a
key module of the healthcare copilot, helping reduce misdiagnosis for
healthcare practitioners and patients. However, the diagnostic accuracy and
specificity of existing heuristic-based RAG models used in the medical domain
are inadequate, particularly for diseases with similar manifestations. This
paper proposes MedRAG, a RAG model enhanced by knowledge graph (KG)-elicited
reasoning for the medical domain that retrieves diagnosis and treatment
recommendations based on manifestations. MedRAG systematically constructs a
comprehensive four-tier hierarchical diagnostic KG encompassing critical
diagnostic differences of various diseases. These differences are dynamically
integrated with similar EHRs retrieved from an EHR database, and reasoned
within a large language model. This process enables more accurate and specific
decision support, while also proactively providing follow-up questions to
enhance personalized medical decision-making. MedRAG is evaluated on both a
public dataset DDXPlus and a private chronic pain diagnostic dataset (CPDD)
collected from Tan Tock Seng Hospital, and its performance is compared against
various existing RAG methods. Experimental results show that, leveraging the
information integration and relational abilities of the KG, our MedRAG provides
more specific diagnostic insights and outperforms state-of-the-art models in
reducing misdiagnosis rates. Our code will be available at
https://github.com/SNOWTEAM2023/MedRAG",http://arxiv.org/abs/2502.04413v1,2/6/25,"Xuejiao Zhao, Siyan Liu, SuYin Yang, Chunyan Miao"
72,RuleRAG: Rule-Guided Retrieval-Augmented Generation with Language Models for Question Answering,"Retrieval-augmented generation (RAG) has shown promising potential in
knowledge intensive question answering (QA). However, existing approaches only
consider the query itself, neither specifying the retrieval preferences for the
retrievers nor informing the generators of how to refer to the retrieved
documents for the answers, which poses a significant challenge to the QA
performance. To address these issues, we propose Rule-guided
Retrieval-Augmented Generation with LMs, which explicitly introduces rules for
in-context learning (RuleRAG-ICL) to guide retrievers to recall related
documents in the directions of rules and uniformly guide generators to reason
attributed by the same rules. Moreover, most existing RAG datasets were
constructed without considering rules and Knowledge Graphs (KGs) are recognized
as providing high-quality rules. Therefore, we construct five rule-aware RAG
benchmarks for QA, RuleQA, based on KGs to stress the significance of retrieval
and reasoning with rules. Experiments on RuleQA demonstrate RuleRAG-ICL
improves the retrieval quality of +89.2% in Recall@10 and answer accuracy of
+103.1% in Exact Match, and RuleRAG-FT yields more enhancement. In addition,
experiments on four existing RAG datasets show RuleRAG is also effective by
offering rules in RuleQA to them, further proving the generalization of rule
guidance in RuleRAG.",http://arxiv.org/abs/2410.22353v3,10/15/24,"Zhongwu Chen, Chengjin Xu, Dingmin Wang, Zhen Huang, Yong Dou, Xuhui Jiang, Jian Guo"
73,AtomR: Atomic Operator-Empowered Large Language Models for Heterogeneous Knowledge Reasoning,"Despite the outstanding capabilities of large language models (LLMs),
knowledge-intensive reasoning still remains a challenging task due to LLMs'
limitations in compositional reasoning and the hallucination problem. A
prevalent solution is to employ chain-of-thought (CoT) with retrieval-augmented
generation (RAG), which first formulates a reasoning plan by decomposing
complex questions into simpler sub-questions, and then applies iterative RAG at
each sub-question. However, prior works exhibit two crucial problems:
inadequate reasoning planning and poor incorporation of heterogeneous
knowledge. In this paper, we introduce AtomR, a framework for LLMs to conduct
accurate heterogeneous knowledge reasoning at the atomic level. Inspired by how
knowledge graph query languages model compositional reasoning through combining
predefined operations, we propose three atomic knowledge operators, a unified
set of operators for LLMs to retrieve and manipulate knowledge from
heterogeneous sources. First, in the reasoning planning stage, AtomR decomposes
a complex question into a reasoning tree where each leaf node corresponds to an
atomic knowledge operator, achieving question decomposition that is highly
fine-grained and orthogonal. Subsequently, in the reasoning execution stage,
AtomR executes each atomic knowledge operator, which flexibly selects,
retrieves, and operates atomic level knowledge from heterogeneous sources. We
also introduce BlendQA, a challenging benchmark specially tailored for
heterogeneous knowledge reasoning. Experiments on three single-source and two
multi-source datasets show that AtomR outperforms state-of-the-art baselines by
a large margin, with F1 score improvements of 9.4% on 2WikiMultihop and 9.5% on
BlendQA. We release our code and datasets.",http://arxiv.org/abs/2411.16495v3,11/25/24,"Amy Xin, Jinxin Liu, Zijun Yao, Zhicheng Lee, Shulin Cao, Lei Hou, Juanzi Li"
74,LLM-assisted Graph-RAG Information Extraction from IFC Data,"IFC data has become the general building information standard for
collaborative work in the construction industry. However, IFC data can be very
complicated because it allows for multiple ways to represent the same product
information. In this research, we utilise the capabilities of LLMs to parse the
IFC data with Graph Retrieval-Augmented Generation (Graph-RAG) technique to
retrieve building object properties and their relations. We will show that,
despite limitations due to the complex hierarchy of the IFC data, the Graph-RAG
parsing enhances generative LLMs like GPT-4o with graph-based knowledge,
enabling natural language query-response retrieval without the need for a
complex pipeline.",http://arxiv.org/abs/2504.16813v1,4/23/25,"Sima Iranmanesh, Hadeel Saadany, Edlira Vakaj"
75,Knowledge Management for Automobile Failure Analysis Using Graph RAG,"This paper presents a knowledge management system for automobile failure
analysis using retrieval-augmented generation (RAG) with large language models
(LLMs) and knowledge graphs (KGs). In the automotive industry, there is a
growing demand for knowledge transfer of failure analysis from experienced
engineers to young engineers. However, failure events are phenomena that occur
in a chain reaction, making them difficult for beginners to analyze them. While
knowledge graphs, which can describe semantic relationships and structure
information is effective in representing failure events, due to their
capability of representing the relationships between components, there is much
information in KGs, so it is challenging for young engineers to extract and
understand sub-graphs from the KG. On the other hand, there is increasing
interest in the use of Graph RAG, a type of RAG that combines LLMs and KGs for
knowledge management. However, when using the current Graph RAG framework with
an existing knowledge graph for automobile failures, several issues arise
because it is difficult to generate executable queries for a knowledge graph
database which is not constructed by LLMs. To address this, we focused on
optimizing the Graph RAG pipeline for existing knowledge graphs. Using an
original Q&A dataset, the ROUGE F1 score of the sentences generated by the
proposed method showed an average improvement of 157.6% compared to the current
method. This highlights the effectiveness of the proposed method for automobile
failure analysis.",http://arxiv.org/abs/2411.19539v1,11/29/24,"Yuta Ojima, Hiroki Sakaji, Tadashi Nakamura, Hiroaki Sakata, Kazuya Seki, Yuu Teshigawara, Masami Yamashita, Kazuhiro Aoyama"
76,Pseudo-Knowledge Graph: Meta-Path Guided Retrieval and In-Graph Text for RAG-Equipped LLM,"The advent of Large Language Models (LLMs) has revolutionized natural
language processing. However, these models face challenges in retrieving
precise information from vast datasets. Retrieval-Augmented Generation (RAG)
was developed to combining LLMs with external information retrieval systems to
enhance the accuracy and context of responses. Despite improvements, RAG still
struggles with comprehensive retrieval in high-volume, low-information-density
databases and lacks relational awareness, leading to fragmented answers.
  To address this, this paper introduces the Pseudo-Knowledge Graph (PKG)
framework, designed to overcome these limitations by integrating Meta-path
Retrieval, In-graph Text and Vector Retrieval into LLMs. By preserving natural
language text and leveraging various retrieval techniques, the PKG offers a
richer knowledge representation and improves accuracy in information retrieval.
Extensive evaluations using Open Compass and MultiHop-RAG benchmarks
demonstrate the framework's effectiveness in managing large volumes of data and
complex relationships.",http://arxiv.org/abs/2503.00309v1,3/1/25,"Yuxin Yang, Haoyang Wu, Tao Wang, Jia Yang, Hao Ma, Guojie Luo"
77,Optimizing open-domain question answering with graph-based retrieval augmented generation,"In this work, we benchmark various graph-based retrieval-augmented generation
(RAG) systems across a broad spectrum of query types, including OLTP-style
(fact-based) and OLAP-style (thematic) queries, to address the complex demands
of open-domain question answering (QA). Traditional RAG methods often fall
short in handling nuanced, multi-document synthesis tasks. By structuring
knowledge as graphs, we can facilitate the retrieval of context that captures
greater semantic depth and enhances language model operations. We explore
graph-based RAG methodologies and introduce TREX, a novel, cost-effective
alternative that combines graph-based and vector-based retrieval techniques.
Our benchmarking across four diverse datasets highlights the strengths of
different RAG methodologies, demonstrates TREX's ability to handle multiple
open-domain QA types, and reveals the limitations of current evaluation
methods.
  In a real-world technical support case study, we demonstrate how TREX
solutions can surpass conventional vector-based RAG in efficiently synthesizing
data from heterogeneous sources. Our findings underscore the potential of
augmenting large language models with advanced retrieval and orchestration
capabilities, advancing scalable, graph-based AI solutions.",http://arxiv.org/abs/2503.02922v1,3/4/25,"Joyce Cahoon, Prerna Singh, Nick Litombe, Jonathan Larson, Ha Trinh, Yiwen Zhu, Andreas Mueller, Fotis Psallidas, Carlo Curino"
78,Hierarchical Planning for Complex Tasks with Knowledge Graph-RAG and Symbolic Verification,"Large Language Models (LLMs) have shown promise as robotic planners but often
struggle with long-horizon and complex tasks, especially in specialized
environments requiring external knowledge. While hierarchical planning and
Retrieval-Augmented Generation (RAG) address some of these challenges, they
remain insufficient on their own and a deeper integration is required for
achieving more reliable systems. To this end, we propose a neuro-symbolic
approach that enhances LLMs-based planners with Knowledge Graph-based RAG for
hierarchical plan generation. This method decomposes complex tasks into
manageable subtasks, further expanded into executable atomic action sequences.
To ensure formal correctness and proper decomposition, we integrate a Symbolic
Validator, which also functions as a failure detector by aligning expected and
observed world states. Our evaluation against baseline methods demonstrates the
consistent significant advantages of integrating hierarchical planning,
symbolic verification, and RAG across tasks of varying complexity and different
LLMs. Additionally, our experimental setup and novel metrics not only validate
our approach for complex planning but also serve as a tool for assessing LLMs'
reasoning and compositional capabilities.",http://arxiv.org/abs/2504.04578v1,4/6/25,"Cristina Cornelio, Flavio Petruzzellis, Pietro Lio"
79,A Pilot Empirical Study on When and How to Use Knowledge Graphs as Retrieval Augmented Generation,"The integration of Knowledge Graphs (KGs) into the Retrieval Augmented
Generation (RAG) framework has attracted significant interest, with early
studies showing promise in mitigating hallucinations and improving model
accuracy. However, a systematic understanding and comparative analysis of the
rapidly emerging KG-RAG methods are still lacking. This paper seeks to lay the
foundation for systematically answering the question of when and how to use
KG-RAG by analyzing their performance in various application scenarios
associated with different technical configurations. After outlining the mind
map using KG-RAG framework and summarizing its popular pipeline, we conduct a
pilot empirical study of KG-RAG works to reimplement and evaluate 6 KG-RAG
methods across 9 datasets in diverse domains and scenarios, analyzing the
impact of 9 KG-RAG configurations in combination with 17 LLMs, and combining
Metacognition with KG-RAG as a pilot attempt. Our results underscore the
critical role of appropriate application conditions and optimal configurations
of KG-RAG components.",http://arxiv.org/abs/2502.20854v3,2/28/25,"Xujie Yuan, Yongxu Liu, Shimin Di, Shiwen Wu, Libin Zheng, Rui Meng, Lei Chen, Xiaofang Zhou, Jian Yin"
80,Knowledge graph enhanced retrieval-augmented generation for failure mode and effects analysis,"Failure mode and effects analysis (FMEA) is an essential tool for mitigating
potential failures, particularly during the ramp-up phases of new products.
However, its effectiveness is often limited by the reasoning capabilities of
the FMEA tools, which are usually tabular structured. Meanwhile, large language
models (LLMs) offer novel prospects for advanced natural language processing
tasks. However, LLMs face challenges in tasks that require factual knowledge, a
gap that retrieval-augmented generation (RAG) approaches aim to fill. RAG
retrieves information from a non-parametric data store and uses a language
model to generate responses. Building on this concept, we propose to enhance
the non-parametric data store with a knowledge graph (KG). By integrating a KG
into the RAG framework, we aim to leverage analytical and semantic
question-answering capabilities for FMEA data. This paper contributes by
presenting set-theoretic standardization and a schema for FMEA data, an
algorithm for creating vector embeddings from the FMEA-KG, and a KG-enhanced
RAG framework. Our approach is validated through a user experience design
study, and we measure the precision and performance of the context retrieval
recall.",http://arxiv.org/abs/2406.18114v3,6/26/24,"Lukas Bahr, Christoph Wehner, Judith Wewerka, Jos Bittencourt, Ute Schmid, Rdiger Daub"
